<?xml version="1.0" encoding="UTF-8"?>
<Puzzles xmlns:xsi="http://www.w3.org/2001/XMLSchema-instance"
  xsi:noNamespaceSchemaLocation="TectonicPuzzles.xsd">

  <Puzzle height="6" width="6" source="Suguru SUG_6x6_v1_4pp_b1 #1">
    <Cell PieceNumber="1" Value="4" />
    <Cell PieceNumber="1" Value="" />
    <Cell PieceNumber="1" Value="" />
    <Cell PieceNumber="2" Value="" />
    <Cell PieceNumber="2" Value="5" />
    <Cell PieceNumber="2" Value="" />
    <Cell PieceNumber="1" Value="" />
    <Cell PieceNumber="3" Value="" />
    <Cell PieceNumber="2" Value="" />
    <Cell PieceNumber="2" Value="" />
    <Cell PieceNumber="4" Value="" />
    <Cell PieceNumber="5" Value="" />
    <Cell PieceNumber="3" Value="" />
    <Cell PieceNumber="3" Value="" />
    <Cell PieceNumber="3" Value="4" />
    <Cell PieceNumber="6" Value="" />
    <Cell PieceNumber="4" Value="" />
    <Cell PieceNumber="5" Value="" />
    <Cell PieceNumber="7" Value="" />
    <Cell PieceNumber="3" Value="" />
    <Cell PieceNumber="6" Value="" />
    <Cell PieceNumber="6" Value="2" />
    <Cell PieceNumber="6" Value="3" />
    <Cell PieceNumber="5" Value="" />
    <Cell PieceNumber="7" Value="" />
    <Cell PieceNumber="7" Value="" />
    <Cell PieceNumber="7" Value="" />
    <Cell PieceNumber="6" Value="" />
    <Cell PieceNumber="5" Value="5" />
    <Cell PieceNumber="5" Value="" />
    <Cell PieceNumber="7" Value="" />
    <Cell PieceNumber="8" Value="" />
    <Cell PieceNumber="8" Value="1" />
    <Cell PieceNumber="8" Value="" />
    <Cell PieceNumber="8" Value="" />
    <Cell PieceNumber="8" Value="" />
  </Puzzle>

</Puzzles>