<?xml version="1.0" encoding="UTF-8"?>
<Puzzles xmlns:xsi="http://www.w3.org/2001/XMLSchema-instance"
  xsi:noNamespaceSchemaLocation="TectonicPuzzles.xsd">

  <Puzzle height="11" width="9" source="Denksport Tectonic 5-7 #30 blz.41 #101">

    <Cell PieceNumber="1" Value="" />
    <Cell PieceNumber="1" Value="" />
    <Cell PieceNumber="1" Value="3" />
    <Cell PieceNumber="1" Value="" />
    <Cell PieceNumber="2" Value="4" />
    <Cell PieceNumber="2" Value="" />
    <Cell PieceNumber="2" Value="2" />
    <Cell PieceNumber="3" Value="4" />
    <Cell PieceNumber="4" Value="" />
    
    <Cell PieceNumber="5" Value="" />
    <Cell PieceNumber="1" Value="" />
    <Cell PieceNumber="6" Value="" />
    <Cell PieceNumber="6" Value="" />
    <Cell PieceNumber="2" Value="" />
    <Cell PieceNumber="2" Value="5" />
    <Cell PieceNumber="3" Value="" />
    <Cell PieceNumber="3" Value="" />
    <Cell PieceNumber="4" Value="" />
    
    <Cell PieceNumber="5" Value="" />
    <Cell PieceNumber="7" Value="" />
    <Cell PieceNumber="8" Value="" />
    <Cell PieceNumber="6" Value="" />
    <Cell PieceNumber="6" Value="" />
    <Cell PieceNumber="6" Value="" />
    <Cell PieceNumber="3" Value="" />
    <Cell PieceNumber="3" Value="" />
    <Cell PieceNumber="9" Value="" />
    
    <Cell PieceNumber="7" Value="" />
    <Cell PieceNumber="7" Value="5" />
    <Cell PieceNumber="8" Value="" />
    <Cell PieceNumber="8" Value="" />
    <Cell PieceNumber="10" Value="" />
    <Cell PieceNumber="10" Value="" />
    <Cell PieceNumber="11" Value="" />
    <Cell PieceNumber="11" Value="" />
    <Cell PieceNumber="9" Value="" />
    
    <Cell PieceNumber="7" Value="" />
    <Cell PieceNumber="7" Value="" />
    <Cell PieceNumber="8" Value="" />
    <Cell PieceNumber="8" Value="" />
    <Cell PieceNumber="10" Value="" />
    <Cell PieceNumber="10" Value="" />
    <Cell PieceNumber="12" Value="" />
    <Cell PieceNumber="11" Value="" />
    <Cell PieceNumber="11" Value="" />
    
    <Cell PieceNumber="13" Value="4" />
    <Cell PieceNumber="13" Value="" />
    <Cell PieceNumber="14" Value="1" />
    <Cell PieceNumber="14" Value="" />
    <Cell PieceNumber="10" Value="" />
    <Cell PieceNumber="12" Value="" />
    <Cell PieceNumber="12" Value="3" />
    <Cell PieceNumber="12" Value="" />
    <Cell PieceNumber="11" Value="" />
    
    <Cell PieceNumber="13" Value="" />
    <Cell PieceNumber="13" Value="" />
    <Cell PieceNumber="14" Value="3" />
    <Cell PieceNumber="14" Value="" />
    <Cell PieceNumber="15" Value="" />
    <Cell PieceNumber="15" Value="" />
    <Cell PieceNumber="12" Value="" />
    <Cell PieceNumber="16" Value="" />
    <Cell PieceNumber="16" Value="" />
    
    <Cell PieceNumber="13" Value="" />
    <Cell PieceNumber="17" Value="" />
    <Cell PieceNumber="14" Value="" />
    <Cell PieceNumber="18" Value="" />
    <Cell PieceNumber="15" Value="" />
    <Cell PieceNumber="15" Value="5" />
    <Cell PieceNumber="15" Value="" />
    <Cell PieceNumber="16" Value="" />
    <Cell PieceNumber="16" Value="" />
    
    <Cell PieceNumber="17" Value="" />
    <Cell PieceNumber="17" Value="" />
    <Cell PieceNumber="19" Value="" />
    <Cell PieceNumber="18" Value="" />
    <Cell PieceNumber="18" Value="" />
    <Cell PieceNumber="20" Value="" />
    <Cell PieceNumber="20" Value="" />
    <Cell PieceNumber="16" Value="" />
    <Cell PieceNumber="21" Value="" />
    
    <Cell PieceNumber="17" Value="3" />
    <Cell PieceNumber="22" Value="" />
    <Cell PieceNumber="22" Value="4" />
    <Cell PieceNumber="22" Value="" />
    <Cell PieceNumber="18" Value="" />
    <Cell PieceNumber="20" Value="" />
    <Cell PieceNumber="20" Value="5" />
    <Cell PieceNumber="23" Value="" />
    <Cell PieceNumber="23" Value="4" />
    
    <Cell PieceNumber="17" Value="" />
    <Cell PieceNumber="24" Value="" />
    <Cell PieceNumber="22" Value="" />
    <Cell PieceNumber="22" Value="" />
    <Cell PieceNumber="18" Value="" />
    <Cell PieceNumber="20" Value="" />
    <Cell PieceNumber="23" Value="" />
    <Cell PieceNumber="23" Value="" />
    <Cell PieceNumber="23" Value="" />
        
  </Puzzle>

</Puzzles>
